{
    "$schema": "https://json-schema.org/draft/2020-12/schema",
    "$id": "https://github.com/PhillyUrbs/HLS-PowerPlatform-Demo/scripts/lib/EnvVarManifest.schema.json",
    "title": "Continuum Env Var Manifest",
    "description": "Authoritative inventory of cch_* Dataverse Environment Variables per Topic 4 (locked 2026-04-29). Consumed by install.ps1, upgrade.ps1, doctor.ps1, and Tier-1 schema-drift validators.",
    "type": "object",
    "additionalProperties": false,
    "required": [
        "version",
        "naming",
        "categories",
        "variables"
    ],
    "properties": {
        "$schema": {
            "type": "string"
        },
        "version": {
            "type": "integer",
            "minimum": 1
        },
        "description": {
            "type": "string"
        },
        "naming": {
            "type": "object",
            "additionalProperties": false,
            "required": [
                "prefix",
                "convention",
                "format"
            ],
            "properties": {
                "prefix": {
                    "type": "string",
                    "const": "cch_"
                },
                "convention": {
                    "type": "string",
                    "const": "PascalCase"
                },
                "format": {
                    "type": "string"
                },
                "exampleValid": {
                    "type": "string"
                },
                "exampleInvalid": {
                    "type": "string"
                }
            }
        },
        "categories": {
            "type": "array",
            "minItems": 6,
            "maxItems": 6,
            "items": {
                "type": "object",
                "required": [
                    "name",
                    "description"
                ],
                "properties": {
                    "name": {
                        "type": "string",
                        "enum": [
                            "Url",
                            "Id",
                            "Secret",
                            "Tunable",
                            "Feature",
                            "Brand"
                        ]
                    },
                    "description": {
                        "type": "string"
                    }
                },
                "additionalProperties": false
            }
        },
        "variables": {
            "type": "array",
            "minItems": 1,
            "items": {
                "$ref": "#/$defs/EnvVar"
            }
        }
    },
    "$defs": {
        "EnvVar": {
            "type": "object",
            "required": [
                "name",
                "category",
                "type",
                "required",
                "default",
                "source",
                "description",
                "readBy"
            ],
            "properties": {
                "name": {
                    "type": "string",
                    "pattern": "^cch_(Url|Id|Secret|Tunable|Feature|Brand)[A-Z][A-Za-z0-9]*$",
                    "description": "Must match cch_<Category><PascalCaseName>."
                },
                "category": {
                    "type": "string",
                    "enum": [
                        "Url",
                        "Id",
                        "Secret",
                        "Tunable",
                        "Feature",
                        "Brand"
                    ]
                },
                "type": {
                    "type": "string",
                    "enum": [
                        "string",
                        "integer",
                        "boolean"
                    ]
                },
                "format": {
                    "type": "string",
                    "enum": [
                        "url",
                        "guid",
                        "secret-ref",
                        "cron",
                        "positive-int",
                        "windows-timezone-id",
                        "hex-color"
                    ],
                    "description": "Optional format hint used by doctor's validation rules."
                },
                "required": {
                    "type": "boolean"
                },
                "default": {
                    "type": [
                        "string",
                        "integer",
                        "boolean",
                        "null"
                    ]
                },
                "source": {
                    "type": "string",
                    "description": "Where the value comes from at install: operator-input | provisioned-by-* | published-by-* | default-or-operator-input | copilot-studio-channel-config | Setup-ServicePrincipal-ps1."
                },
                "description": {
                    "type": "string",
                    "minLength": 10
                },
                "readBy": {
                    "type": "array",
                    "minItems": 1,
                    "items": {
                        "type": "string"
                    },
                    "description": "Free-text list of consumers (flows / agents / components / docs) for traceability."
                }
            },
            "additionalProperties": false,
            "allOf": [
                {
                    "if": {
                        "properties": {
                            "category": {
                                "const": "Url"
                            }
                        }
                    },
                    "then": {
                        "properties": {
                            "format": {
                                "const": "url"
                            }
                        }
                    }
                },
                {
                    "if": {
                        "properties": {
                            "category": {
                                "const": "Id"
                            }
                        }
                    },
                    "then": {
                        "properties": {
                            "format": {
                                "const": "guid"
                            }
                        }
                    }
                },
                {
                    "if": {
                        "properties": {
                            "category": {
                                "const": "Secret"
                            }
                        }
                    },
                    "then": {
                        "properties": {
                            "format": {
                                "const": "secret-ref"
                            }
                        }
                    }
                },
                {
                    "if": {
                        "properties": {
                            "category": {
                                "const": "Feature"
                            }
                        }
                    },
                    "then": {
                        "properties": {
                            "type": {
                                "const": "boolean"
                            }
                        }
                    }
                }
            ]
        }
    }
}
