{
    "$schema": "./EnvVarManifest.schema.json",
    "version": 1,
    "description": "Machine-readable inventory of all Dataverse Environment Variables the demo solution defines. Authoritative source per Topic 4. Consumed by install.ps1 (prompt for missing required), upgrade.ps1 (detect deltas), doctor.ps1 (validate format + presence), and the Tier-1 schema-drift validator.",
    "naming": {
        "prefix": "cch_",
        "convention": "PascalCase",
        "format": "cch_<Category><Name>",
        "exampleValid": "cch_UrlSharePointSite",
        "exampleInvalid": "CCH_URL_SHAREPOINT_SITE"
    },
    "categories": [
        {
            "name": "Url",
            "description": "URLs of provisioned resources. Must be https; must not contain localhost or 127.0.0.1 (locked runtime independence)."
        },
        {
            "name": "Id",
            "description": "GUIDs / IDs of provisioned resources (Teams team/channel, SharePoint library, Entra app reg, Copilot Studio agent)."
        },
        {
            "name": "Secret",
            "description": "Secret references via the SecretRef abstraction (Topic 4): plain:<value> or kv:<keyVault>/<secret>[?version=<v>]. Doctor warns on plain:* mode in info-level findings."
        },
        {
            "name": "Tunable",
            "description": "Demo behavior tunables (cron strings, intervals, MDR clock duration). Per-env overridable."
        },
        {
            "name": "Feature",
            "description": "Per-vignette / per-feature boolean flags. All ON by default at install (Topic 4)."
        },
        {
            "name": "Brand",
            "description": "Brand strings surfaced in UI footer / agent salutation / Demo Mode banner."
        }
    ],
    "variables": [
        {
            "name": "cch_UrlSharePointSite",
            "category": "Url",
            "type": "string",
            "format": "url",
            "required": true,
            "default": null,
            "source": "operator-input",
            "description": "SharePoint site holding the Continuum Knowledge library and weekly republished grounding docs.",
            "readBy": [
                "Continuum Enablement agent",
                "Patient Support agent (Patient persona)",
                "Quality Triage agent",
                "templated-doc weekly republish flow"
            ]
        },
        {
            "name": "cch_UrlPagesSite",
            "category": "Url",
            "type": "string",
            "format": "url",
            "required": true,
            "default": null,
            "source": "provisioned-by-pac-pages-activate; written-back-by-install",
            "description": "The deployed Power Pages site URL (V1 + V2 surfaces).",
            "readBy": [
                "Patient Support agent V1 deep links",
                "PostQualityTriageCard 'Open in Quality Workspace' button"
            ]
        },
        {
            "name": "cch_UrlCodeApp",
            "category": "Url",
            "type": "string",
            "format": "url",
            "required": true,
            "default": null,
            "source": "provisioned-by-pac-code-deploy; written-back-by-install",
            "description": "The deployed Power Apps Code App URL (V3, V4, V5 surfaces).",
            "readBy": [
                "TriageCard / ChannelUpdateCard 'Open in app' buttons",
                "Quality Triage 'Open in Quality Workspace' deep link"
            ]
        },
        {
            "name": "cch_UrlTeamsTenant",
            "category": "Url",
            "type": "string",
            "format": "url",
            "required": false,
            "default": "https://teams.microsoft.com/l/",
            "source": "default-or-operator-input",
            "description": "Base URL for composing Teams deep links.",
            "readBy": [
                "Adaptive Card deep-link composition"
            ]
        },
        {
            "name": "cch_UrlGraphBase",
            "category": "Url",
            "type": "string",
            "format": "url",
            "required": false,
            "default": "https://graph.microsoft.com/v1.0",
            "source": "default-or-operator-input",
            "description": "Microsoft Graph base URL used by Teams channel-post flow.",
            "readBy": [
                "Teams channel post flow",
                "PostQualityTriageCard",
                "PostTeamsChannelUpdate"
            ]
        },
        {
            "name": "cch_IdTeamsTeam",
            "category": "Id",
            "type": "string",
            "format": "guid",
            "required": true,
            "default": null,
            "source": "provisioned-by-install; written-back",
            "description": "GUID of the Teams team containing the demo channels (Quality, Field, Enablement, Leadership).",
            "readBy": [
                "All Teams channel-post flows"
            ]
        },
        {
            "name": "cch_IdTeamsChannelQuality",
            "category": "Id",
            "type": "string",
            "format": "guid",
            "required": true,
            "default": null,
            "source": "provisioned-by-install; written-back",
            "description": "Quality Triage Teams channel — receives V4 triage cards.",
            "readBy": [
                "PostQualityTriageCard"
            ]
        },
        {
            "name": "cch_IdTeamsChannelLeadership",
            "category": "Id",
            "type": "string",
            "format": "guid",
            "required": true,
            "default": null,
            "source": "provisioned-by-install; written-back",
            "description": "Leadership Teams channel — receives V4 escalation cards.",
            "readBy": [
                "EscalateComplaint"
            ]
        },
        {
            "name": "cch_IdTeamsChannelField",
            "category": "Id",
            "type": "string",
            "format": "guid",
            "required": true,
            "default": null,
            "source": "provisioned-by-install; written-back",
            "description": "Field team Teams channel — receives V3 FCS channel updates.",
            "readBy": [
                "PostTeamsChannelUpdate"
            ]
        },
        {
            "name": "cch_IdTeamsChannelEnablement",
            "category": "Id",
            "type": "string",
            "format": "guid",
            "required": true,
            "default": null,
            "source": "provisioned-by-install; written-back",
            "description": "Enablement Teams channel — receives V5/V6 enablement-tool result cards (sample orders, training schedules).",
            "readBy": [
                "OrderSamples",
                "ScheduleTraining"
            ]
        },
        {
            "name": "cch_IdSharePointLibraryKnowledge",
            "category": "Id",
            "type": "string",
            "format": "guid",
            "required": true,
            "default": null,
            "source": "provisioned-by-install; written-back",
            "description": "SharePoint library 'Continuum Knowledge' GUID — agents ground on subfolders inside.",
            "readBy": [
                "Continuum Enablement agent grounding",
                "Patient Support agent FAQ topics",
                "Quality Triage agent regulatory-glossary lookups",
                "templated-doc republish flow"
            ]
        },
        {
            "name": "cch_IdAgentPatientSupport",
            "category": "Id",
            "type": "string",
            "format": "guid",
            "required": true,
            "default": null,
            "source": "published-by-copilot-studio",
            "description": "Patient Support agent ID (used for V1 floating bubble + V2 dashboard panel + V3 docked panel).",
            "readBy": [
                "AgentChatHost component",
                "cch_IssueDirectLineToken flow"
            ]
        },
        {
            "name": "cch_IdAgentQualityTriage",
            "category": "Id",
            "type": "string",
            "format": "guid",
            "required": true,
            "default": null,
            "source": "published-by-copilot-studio",
            "description": "Quality Triage agent ID (V4 triggered by cch_TriggerQualityTriage flow + V4 docked analyst chat).",
            "readBy": [
                "cch_TriggerQualityTriage",
                "AgentChatHost component (V4 docked panel)"
            ]
        },
        {
            "name": "cch_IdAgentEnablement",
            "category": "Id",
            "type": "string",
            "format": "guid",
            "required": true,
            "default": null,
            "source": "published-by-copilot-studio",
            "description": "Continuum Enablement agent ID (V5 Knowledge tab + V6 multi-surface).",
            "readBy": [
                "AgentChatHost component (V5 fullScreen)",
                "Teams app manifest",
                "SharePoint webpart",
                "M365 Copilot agent picker"
            ]
        },
        {
            "name": "cch_IdEntraAppPagesAuth",
            "category": "Id",
            "type": "string",
            "format": "guid",
            "required": true,
            "default": null,
            "source": "provisioned-by-install (Lead PR #2 per Topic 11 §A3)",
            "description": "Entra app registration for Power Pages identity provider.",
            "readBy": [
                "Pages auth wiring (sites/continuum-portal/)",
                "install.ps1 provision-entra-apps mode"
            ]
        },
        {
            "name": "cch_IdEntraAppServicePrincipal",
            "category": "Id",
            "type": "string",
            "format": "guid",
            "required": true,
            "default": null,
            "source": "provisioned-by-Setup-ServicePrincipal-ps1",